{
  "$schema": "https://json-schema.org/draft/2020-12/schema",
  "$id": "urn:nexloop:contracts:v1:claim",
  "title": "claim",
  "description": "NX-019. One evidence-bound Claim extracted from persisted conversation Messages: candidate knowledge, never a formal business object. Identity, tenant, world, consumer and evidence are server-derived; extractors never produce verified_fact. Not an existing upstream API.",
  "type": "object",
  "additionalProperties": false,
  "properties": {
    "claim_id": {
      "type": "string",
      "pattern": "^[0-9a-f]{64}$"
    },
    "tenant_id": {
      "type": "string",
      "format": "uuid"
    },
    "world_id": {
      "type": "string",
      "minLength": 1
    },
    "mode": {
      "type": "string",
      "enum": [
        "real",
        "simulation",
        "shadow",
        "test"
      ],
      "description": "Derived from world_id by the server, never supplied by a caller: world real -> real; worlds simulation and shadow -> simulation; any other world -> test. The enum matches the other contracts; shadow is excluded below."
    },
    "conversation_id": {
      "type": "string",
      "pattern": "^[0-9a-f]{64}$"
    },
    "consumer_id": {
      "type": "string",
      "pattern": "^[0-9a-f]{64}$"
    },
    "topic_key": {
      "type": "string",
      "pattern": "^[0-9a-f]{64}$"
    },
    "subject": {
      "type": "object",
      "additionalProperties": false,
      "required": [
        "kind",
        "ref",
        "text"
      ],
      "properties": {
        "kind": {
          "enum": [
            "consumer",
            "enterprise",
            "entity"
          ]
        },
        "ref": {
          "type": "string",
          "description": "consumer: server-derived consumer object id; otherwise empty"
        },
        "text": {
          "type": "string",
          "maxLength": 200,
          "description": "referent words present in the topic window, or empty"
        }
      },
      "if": {
        "properties": {
          "kind": {
            "const": "consumer"
          }
        }
      },
      "then": {
        "properties": {
          "ref": {
            "type": "string",
            "pattern": "^[0-9a-f]{64}$"
          }
        }
      },
      "else": {
        "properties": {
          "ref": {
            "const": ""
          }
        }
      }
    },
    "predicate": {
      "type": "string",
      "minLength": 1,
      "maxLength": 120
    },
    "value": {
      "type": "object",
      "additionalProperties": false,
      "required": [
        "type",
        "value"
      ],
      "properties": {
        "type": {
          "enum": [
            "string",
            "number",
            "boolean",
            "money",
            "none"
          ]
        },
        "value": {}
      },
      "allOf": [
        {
          "if": {
            "properties": {
              "type": {
                "const": "string"
              }
            }
          },
          "then": {
            "properties": {
              "value": {
                "type": "string",
                "minLength": 1,
                "maxLength": 2000
              }
            }
          }
        },
        {
          "if": {
            "properties": {
              "type": {
                "const": "number"
              }
            }
          },
          "then": {
            "properties": {
              "value": {
                "type": "number"
              }
            }
          }
        },
        {
          "if": {
            "properties": {
              "type": {
                "const": "boolean"
              }
            }
          },
          "then": {
            "properties": {
              "value": {
                "type": "boolean"
              }
            }
          }
        },
        {
          "if": {
            "properties": {
              "type": {
                "const": "money"
              }
            }
          },
          "then": {
            "properties": {
              "value": {
                "type": "object",
                "additionalProperties": false,
                "required": [
                  "amount",
                  "currency"
                ],
                "properties": {
                  "amount": {
                    "type": "number"
                  },
                  "currency": {
                    "type": "string",
                    "pattern": "^[A-Z]{3}$"
                  }
                }
              }
            }
          }
        },
        {
          "if": {
            "properties": {
              "type": {
                "const": "none"
              }
            }
          },
          "then": {
            "properties": {
              "value": {
                "type": "null"
              }
            }
          }
        }
      ]
    },
    "speaker": {
      "enum": [
        "consumer",
        "agent"
      ]
    },
    "polarity": {
      "enum": [
        "affirmed",
        "negated"
      ]
    },
    "modality": {
      "enum": [
        "asserted",
        "conditional",
        "tentative",
        "requested"
      ]
    },
    "condition": {
      "type": "string",
      "maxLength": 400,
      "description": "verbatim condition clause; required when modality=conditional"
    },
    "time_expression": {
      "type": "string",
      "maxLength": 80
    },
    "valid_time": {
      "type": "object",
      "additionalProperties": false,
      "required": [
        "expression",
        "kind",
        "status",
        "start",
        "end",
        "timezone",
        "anchor"
      ],
      "properties": {
        "expression": {
          "type": "string",
          "maxLength": 80
        },
        "kind": {
          "enum": [
            "none",
            "point",
            "interval",
            "deadline",
            "unparsed",
            "past_reference"
          ]
        },
        "status": {
          "enum": [
            "absent",
            "resolved",
            "ambiguous",
            "unresolved"
          ]
        },
        "granularity": {
          "enum": [
            "minute",
            "hour",
            "day",
            "part_of_day",
            "am_pm_unspecified",
            "period",
            "month"
          ]
        },
        "start": {
          "anyOf": [
            {
              "type": "string",
              "format": "date-time",
              "pattern": "^\\d{4}-\\d{2}-\\d{2}T\\d{2}:\\d{2}:\\d{2}(\\.\\d{1,9})?(Z|[+-]\\d{2}:\\d{2})$"
            },
            {
              "type": "null"
            }
          ]
        },
        "end": {
          "anyOf": [
            {
              "type": "string",
              "format": "date-time",
              "pattern": "^\\d{4}-\\d{2}-\\d{2}T\\d{2}:\\d{2}:\\d{2}(\\.\\d{1,9})?(Z|[+-]\\d{2}:\\d{2})$"
            },
            {
              "type": "null"
            }
          ]
        },
        "latest_bound_window": {
          "type": "array",
          "items": {
            "type": "string",
            "format": "date-time",
            "pattern": "^\\d{4}-\\d{2}-\\d{2}T\\d{2}:\\d{2}:\\d{2}(\\.\\d{1,9})?(Z|[+-]\\d{2}:\\d{2})$"
          },
          "minItems": 2,
          "maxItems": 2
        },
        "timezone": {
          "type": "string",
          "minLength": 1,
          "maxLength": 64,
          "description": "IANA tenant timezone"
        },
        "anchor": {
          "type": "string",
          "format": "date-time",
          "pattern": "^\\d{4}-\\d{2}-\\d{2}T\\d{2}:\\d{2}:\\d{2}(\\.\\d{1,9})?(Z|[+-]\\d{2}:\\d{2})$",
          "description": "server acceptance time of the cited Message"
        },
        "normalization": {
          "type": "object",
          "additionalProperties": false,
          "required": [
            "source",
            "verdict"
          ],
          "description": "Owner 2026-10-17: how the time was read. Present when the extraction model proposed an absolute reading: source (rule: the proposal was refused or not used; llm: the rules could not read it and the checked proposal stands; llm+rule: both agree; conflict: both read it differently, neither chosen), verdict (accepted, agreed, conflict, or the refusal code), both readings and the model's stated assumptions. Absent on Claims extracted before it.",
          "properties": {
            "source": {
              "enum": [
                "rule",
                "llm",
                "llm+rule",
                "conflict"
              ]
            },
            "verdict": {
              "type": "string",
              "pattern": "^[a-z_]{1,64}$"
            },
            "llm": {
              "anyOf": [
                {
                  "type": "object",
                  "additionalProperties": false,
                  "required": [
                    "kind",
                    "start",
                    "end"
                  ],
                  "properties": {
                    "kind": {
                      "enum": [
                        "point",
                        "interval",
                        "deadline"
                      ]
                    },
                    "start": {
                      "type": "string",
                      "format": "date-time",
                      "pattern": "^\\d{4}-\\d{2}-\\d{2}T\\d{2}:\\d{2}:\\d{2}(\\.\\d{1,9})?(Z|[+-]\\d{2}:\\d{2})$"
                    },
                    "end": {
                      "type": "string",
                      "format": "date-time",
                      "pattern": "^\\d{4}-\\d{2}-\\d{2}T\\d{2}:\\d{2}:\\d{2}(\\.\\d{1,9})?(Z|[+-]\\d{2}:\\d{2})$"
                    },
                    "granularity": {
                      "enum": [
                        "minute",
                        "hour",
                        "day",
                        "part_of_day",
                        "am_pm_unspecified",
                        "period",
                        "month"
                      ]
                    }
                  }
                },
                {
                  "type": "null"
                }
              ]
            },
            "rule": {
              "anyOf": [
                {
                  "type": "object",
                  "additionalProperties": false,
                  "required": [
                    "kind",
                    "start",
                    "end"
                  ],
                  "properties": {
                    "kind": {
                      "enum": [
                        "point",
                        "interval",
                        "deadline"
                      ]
                    },
                    "start": {
                      "type": "string",
                      "format": "date-time",
                      "pattern": "^\\d{4}-\\d{2}-\\d{2}T\\d{2}:\\d{2}:\\d{2}(\\.\\d{1,9})?(Z|[+-]\\d{2}:\\d{2})$"
                    },
                    "end": {
                      "type": "string",
                      "format": "date-time",
                      "pattern": "^\\d{4}-\\d{2}-\\d{2}T\\d{2}:\\d{2}:\\d{2}(\\.\\d{1,9})?(Z|[+-]\\d{2}:\\d{2})$"
                    },
                    "granularity": {
                      "enum": [
                        "minute",
                        "hour",
                        "day",
                        "part_of_day",
                        "am_pm_unspecified",
                        "period",
                        "month"
                      ]
                    }
                  }
                },
                {
                  "type": "null"
                }
              ]
            },
            "assumptions": {
              "type": "array",
              "items": {
                "type": "string",
                "maxLength": 200
              },
              "maxItems": 8
            }
          }
        }
      },
      "allOf": [
        {
          "if": {
            "properties": {
              "status": {
                "enum": [
                  "absent",
                  "unresolved"
                ]
              }
            }
          },
          "then": {
            "properties": {
              "start": {
                "type": "null"
              },
              "end": {
                "type": "null"
              }
            }
          },
          "else": {
            "properties": {
              "start": {
                "type": "string",
                "format": "date-time",
                "pattern": "^\\d{4}-\\d{2}-\\d{2}T\\d{2}:\\d{2}:\\d{2}(\\.\\d{1,9})?(Z|[+-]\\d{2}:\\d{2})$"
              },
              "end": {
                "type": "string",
                "format": "date-time",
                "pattern": "^\\d{4}-\\d{2}-\\d{2}T\\d{2}:\\d{2}:\\d{2}(\\.\\d{1,9})?(Z|[+-]\\d{2}:\\d{2})$"
              }
            }
          }
        }
      ]
    },
    "source": {
      "anyOf": [
        {
          "type": "object",
          "additionalProperties": false,
          "required": [
            "message_id",
            "sequence",
            "span_start",
            "span_end",
            "content_hash",
            "quote"
          ],
          "properties": {
            "message_id": {
              "type": "string",
              "pattern": "^[0-9a-f]{64}$"
            },
            "sequence": {
              "type": "integer",
              "minimum": 1
            },
            "span_start": {
              "type": "integer",
              "minimum": 0,
              "description": "Unicode code point offset into the Message body"
            },
            "span_end": {
              "type": "integer",
              "minimum": 1
            },
            "content_hash": {
              "type": "string",
              "pattern": "^[0-9a-f]{64}$",
              "description": "sha256 of the full Message body (UTF-8)"
            },
            "quote": {
              "type": "string",
              "minLength": 1
            }
          }
        },
        {
          "type": "null"
        }
      ]
    },
    "derived_from": {
      "type": "array",
      "items": {
        "type": "string",
        "pattern": "^[0-9a-f]{64}$"
      },
      "uniqueItems": true,
      "maxItems": 256
    },
    "corrects_claim_id": {
      "anyOf": [
        {
          "type": "string",
          "pattern": "^[0-9a-f]{64}$"
        },
        {
          "type": "null"
        }
      ]
    },
    "extractor_version": {
      "type": "string",
      "minLength": 1,
      "maxLength": 80
    },
    "confidence": {
      "type": "number",
      "minimum": 0,
      "maximum": 1,
      "description": "extractor self-estimate, not calibrated"
    },
    "epistemic_kind": {
      "enum": [
        "user_statement",
        "verified_fact",
        "preference",
        "constraint",
        "intent",
        "need_problem",
        "commitment",
        "hypothesis",
        "correction"
      ]
    },
    "resolution_state": {
      "enum": [
        "unresolved",
        "hypothesis_only",
        "needs_resolution",
        "awaiting_definition",
        "rejected_definition",
        "resolved",
        "superseded"
      ]
    },
    "correlation_key": {
      "type": "string",
      "pattern": "^[0-9a-f]{64}$",
      "description": "same consumer+kind+predicate+normalized value+polarity; links repeats, never deduplicates"
    },
    "guard_flags": {
      "type": "array",
      "items": {
        "type": "string",
        "minLength": 1,
        "maxLength": 80
      },
      "uniqueItems": true,
      "maxItems": 64
    },
    "recorded_at": {
      "type": "string",
      "format": "date-time",
      "pattern": "^\\d{4}-\\d{2}-\\d{2}T\\d{2}:\\d{2}:\\d{2}(\\.\\d{1,9})?(Z|[+-]\\d{2}:\\d{2})$"
    }
  },
  "required": [
    "claim_id",
    "tenant_id",
    "world_id",
    "mode",
    "conversation_id",
    "consumer_id",
    "topic_key",
    "subject",
    "predicate",
    "value",
    "speaker",
    "polarity",
    "modality",
    "condition",
    "time_expression",
    "valid_time",
    "source",
    "derived_from",
    "corrects_claim_id",
    "extractor_version",
    "confidence",
    "epistemic_kind",
    "resolution_state",
    "correlation_key",
    "guard_flags",
    "recorded_at"
  ],
  "allOf": [
    {
      "description": "extractors never produce verified_fact; only verification channels may, outside this contract",
      "properties": {
        "epistemic_kind": {
          "not": {
            "const": "verified_fact"
          }
        }
      }
    },
    {
      "if": {
        "properties": {
          "epistemic_kind": {
            "const": "hypothesis"
          }
        }
      },
      "then": {
        "properties": {
          "resolution_state": {
            "enum": [
              "hypothesis_only",
              "superseded"
            ]
          }
        },
        "anyOf": [
          {
            "properties": {
              "source": {
                "type": "object"
              }
            }
          },
          {
            "properties": {
              "derived_from": {
                "minItems": 1
              }
            }
          }
        ]
      },
      "else": {
        "properties": {
          "source": {
            "type": "object"
          },
          "derived_from": {
            "maxItems": 0
          },
          "resolution_state": {
            "not": {
              "const": "hypothesis_only"
            }
          }
        }
      }
    },
    {
      "if": {
        "properties": {
          "modality": {
            "const": "conditional"
          }
        }
      },
      "then": {
        "properties": {
          "condition": {
            "minLength": 1
          }
        }
      }
    },
    {
      "if": {
        "properties": {
          "corrects_claim_id": {
            "type": "string"
          }
        }
      },
      "then": {
        "properties": {
          "epistemic_kind": {
            "const": "correction"
          }
        }
      }
    },
    {
      "if": {
        "properties": {
          "speaker": {
            "const": "agent"
          }
        }
      },
      "then": {
        "properties": {
          "epistemic_kind": {
            "enum": [
              "commitment",
              "hypothesis"
            ]
          }
        }
      }
    },
    {
      "if": {
        "properties": {
          "speaker": {
            "const": "consumer"
          }
        }
      },
      "then": {
        "properties": {
          "epistemic_kind": {
            "not": {
              "const": "commitment"
            }
          }
        }
      }
    },
    {
      "description": "claims are derived per world and never carry shadow mode (shadow worlds project as simulation)",
      "properties": {
        "mode": {
          "not": {
            "const": "shadow"
          }
        }
      }
    },
    {
      "if": {
        "properties": {
          "mode": {
            "const": "real"
          }
        },
        "required": [
          "mode"
        ]
      },
      "then": {
        "properties": {
          "world_id": {
            "const": "real"
          }
        }
      },
      "else": {
        "properties": {
          "world_id": {
            "not": {
              "const": "real"
            }
          }
        }
      }
    }
  ]
}
